title,date,desc
آغاز رویداد بزرگ رسانه‌ای بانک اقتصاد نوین,۱۴۰۴/۰۲/۲۷,آغاز رویداد بزرگ رسانه‌ای بانک اقتصاد نوین همزمان با گردهمایی گرامیداشت «27 اردیبهشت ماه، روز ارتباطات و روابط عمومی» در بانک اقتصادنوین، فراخوان جشنواره «با رسانه؛ از بانکداری خصوصی تا بانکداری نوین» منتشر شد. به گزارش روابط عمومی بانک اقتصادنوین، این جشنواره با راهبرد تعمیق ارتباط متقابل میان بانک و رسانه‌ها با هدف توسعه همکاری‌ها به منظور معرفی هر چه بیشتر خدمات نظام بانکداری به جامعه برگزار می‌شود. آثار برگزیده این جشنواره که از سوی اساتید به‌نام روزنامه‌نگاری و علوم ارتباطات ارزیابی خواهند شد، همزمان با 17 مرداد ماه روز خبرنگار و در آستانه فرارسیدن بیست و چهارمین سالگرد تاسیس بانک اقتصادنوین معرفی می‌شوند. متن فراخوان جشنواره، به شرح زیر است: جشنواره «با رسانه؛ از بانکداری خصوصی تا بانکداری نوین» برگزار می‌شود در آستانه فرارسیدن هفدهم مردادماه، روز خبرنگار و هم‌زمان با بیست و چهارمین سالگرد تأسیس بانک اقتصاد نوین، جشنواره «با رسانه؛ از بانکداری خصوصی تا بانکداری نوین» با هدف گرامیداشت تلاش‌های اهالی رسانه و تعمیق ارتباط متقابل میان بانک و رسانه‌ها برگزار می‌شود. اهداف جشنواره: مروری بر بانکداری خصوصی در رسانه‌ها، از دیروز تا امروز ارائه راهکارهای تعامل بیشتر میان مثلث بانک، مشتری، رسانه نگاهی به تحولات پرتغییر عرصه بانکداری فردا از بستر واقعی تا بستر وب هوشمند تلاش توامان رسانه و بانک برای شناخت مزایا و آسیب‌های بانکداری فردا و مشتریان نسل‌ آلفا اثر رسانه در ایجاد حس تعاملی و سازنده میان بانک و بانکدار با جامعه محورهای جشنواره: معرفی ظرفیت‌های نوین ایجادشده در حوزه خدمات بانکی، مالی و اقتصادی بازتاب اقدامات بانک‌ها در حوزه مسئولیت‌های اجتماعی بررسی نقش بانک‌ها در حل چالش‌های مالی فعالان اقتصادی و بنگاه‌های تولیدی و خدماتی تحلیل نقش ربع قرن حضور بانک اقتصاد نوین به‌عنوان نخستین بانک خصوصی کشور در توسعه فضای بانکداری غیردولتی تبیین عملکرد، معرفی خدمات و محصولات بانک اقتصادنوین بخش اصلی: آثار ارسالی برای شرکت در بخش اصلی جشنواره می‌توانند در انواع قالب‌های متنی و مکتوب، صوتی، اینفوگرافی، ویدئویی و تصویری تهیه شوند. بخش محتوای متنی یا مکتوب در قالب فرم‌های عمده روزنامه‌نگاری شامل؛ خبر و گزارش خبری گزارش یادداشت / سرمقاله گفت‌وگو تیتر بخش صوتی شامل: پادکست (گزارشی، موضوعی) بخش تصویری - ویدئویی شامل: عکس طرح و اینفوگرافی کارتون انواع محتواهای ویدئویی شرایط شرکت در بخش اصلی جشنواره: همه رسانه‌های دارای مجوز رسمی از وزارت فرهنگ و ارشاد اسلامی از سراسر کشور می‌توانند در این جشنواره تخصصی شرکت کنند. محدودیتی در تعداد و تنوع آثار ارسالی وجود ندارد، اما آثار ارسالی باید منحصر به همین جشنواره بوده و پیش‌ازاین در جشنواره و یا رویداد مشابه دیگری شرکت داده نشده باشد. سقف ارسال اثر در هر رشته، ۳ اثر است و هر شرکت‌کننده تنها در دو رشته می‌تواند اثر ارسال کند. از زمان تولید آثار تا پایان زمان ارسال آن‌ها به دبیرخانه جشنواره، نباید بیش از یک سال گذشته باشد. شرکت تمامی عکاسان دارای معرفی‌نامه از سوی یک رسانه دارای مجوز، در این بخش جشنواره آزاد است. حداکثر عکس ارسالی می‌تواند ۵ فریم رنگی یا سیاه‌وسفید با سایز فایل حداقل ۳ مگابایت و رزولوشن :150dpi در فرمت JPEG باشد. شرکت‌کنندگان در جشنواره متعهد می‌شوند که آثار ارسالی متعلق به خودشان بوده است و در این خصوص مسئولیت عدم رعایت حقوق کپی‌برداری بر عهده ارسال‌کننده خواهد بود. بانک اقتصادنوین با افتخار، از آثار ارسال‌شده و انتخابی هیئت‌داوران برای درج در نشریه، آرشیو و هرگونه محتوا- با قید نام و مشخصات صاحب اثر -استفاده خواهد کرد. بخش جانبی: بانک اقتصادنوین قصد دارد از توانایی‌های «نسل کودک و نوجوان» نیز در طراحی و پیاده‌سازی اهداف استراتژیک خود استفاده کند. به این منظور، در این جشنواره نیز بخشی با عنوان «نوین نگار» را با همین هدف طراحی کرده است. در این بخش، همه آثار تهیه‌شده توسط افراد کمتر از ۱۸ سال در قالب‌های چهارگانه متنی، صوتی، تصویری و ویدئویی با محور بانک اقتصادنوین و محصولات آن ارزیابی می‌شود و به آثار برگزیده جوایز ارزنده‌ای تعلق خواهد گرفت. فعالان شبکه‌های اجتماعی نیز می‌توانند از توانایی خود برای حضور در این جشنواره بهره بگیرند. محتوای تولیدی که پیش از انتشار به تایید دبیرخانه رسیده، سپس در شبکه‌های اجتماعی با #اقتصاد_نوین و یا #نوین_نگار همراه بوده و بیشترین میزان بازدید را داشته باشند، از سوی هیئت‌داوران مورد ارزیابی و تقدیر قرار خواهند گرفت. جوایز: دبیرخانه جشنواره، جوایز 300 میلیون ریالی برای نفر برگزیده، 200میلیون ریالی برای نفر دوم و 10۰میلیون ریالی برای نفر سوم در هر یک از زیرمجوعه‌های 10 گانه بخش اصلی اهدا خواهد کرد. همچنین دو جایزه 200 میلیون ریالی و دو جایزه 1۰۰ میلیون ریالی برای آثار برگزیده «نوین نگار» و سه جایزه ۲۰۰ میلیون ریالی برای آثار برگزیده شبکه‌های اجتماعی در نظر گرفته شده است. زمان‌بندی جشنواره: مهلت نهایی ارسال آثار: ۱۵ تیرماه۱۴۰۴ پایان فرآیند داوری: ۱۰ مردادماه ۱۴۰۴ برگزاری آیین اختتامیه و اعلام نتایج: ۲۰ مردادماه ۱۴۰۴ نحوه ارسال آثار: علاقه‌مندان می‌توانند آثار خود را از طریق صفحه جشنواره در سایت بانک اقتصادنوین به دبیرخانه ارسال کنند. با احترام دبیرخانه جشنواره «با رسانه؛ از بانکداری خصوصی تا بانکداری نوین»
چهارشنبه، عرضه اولیه سهام «ولنوین»,۱۴۰۴/۰۲/۲۸,چهارشنبه، عرضه اولیه سهام «ولنوین» سهام شرکت لیزینگ بانک اقتصاد نوین با نماد «ولنوین»، روز چهارشنبه 31 اردیبهشت ماه 1404 در بازار دوم بورس عرضه اولیه می‌شود. به گزارش روابط عمومی بانک اقتصادنوین، در جلسه معارفه این شرکت که با حضور محمدعلی رستگار سرخه عضو هیئت مدیره بانک اقتصادنوین و مدیرعامل و جمعی از مدیران ارشد شرکت لیزینگ بانک اقتصاد نوین برگزار شد، ابتدا گزارشی از عملکرد شرکت در سال‌های گذشته ارائه و شرایط کنونی شرکت تشریح شد. ایمان فرجام نیا مدیرعامل لیزینگ بانک اقتصاد نوین نیز با بیان این که اکنون کمترین میزان نسبت مطالبات غیرجاری به کل تسهیلات پرداختی (NPL) صنعت لیزینگ به این شرکت تعلق دارد، گفت: حمایت‌های بانک اقتصادنوین در کمک به تامین مالی متقاضیان استفاده از خدمات شرکت، بسیار چشمگیر بوده و قابل تقدیر است. وی افزود: بسته‌های متنوعی برای متقاضیان خدمات لیزینگ اقتصادنوین طراحی شده است تا نیازهای آنها در تامین مالی خرید اقساطی و یا اجاره به شرط تملیک را برآورده کند. به گفته فرجام نیا، لیزینگ اقتصادنوین یکی از 14 شرکت لیزینگ پذیرفته شده در بورس اوراق بهادار از میان 62 شرکت لیزینگ دارای مجوز است که در شاخص سود خالص، رتبه دوم را در میان رقبا دارد. مدیرعامل لیزینگ اقتصادنوین همچنین از برنامه فروش سهام شرکت سرمایه‌گذاری اقتصادنوین و املاک تملیکی این شرکت خبر داد و افزود: شرکت طی سال‌های گذشته پیوسته در حال افزایش سرمایه بوده و بر اساس سرمایه جدید، ارزش هر سهم آن 2867 ریال است.
اعلام ترکیب هیئت داوران جشنواره «با رسانه؛ از بانکداری خصوصی تا بانکداری نوین»,۱۴۰۴/۰۲/۲۹,اعلام ترکیب هیئت داوران جشنواره «با رسانه؛ از بانکداری خصوصی تا بانکداری نوین» ترکیب هیئت داوران جشنواره «با رسانه؛ از بانکداری خصوصی تا بانکداری نوین» مشخص شد. به گزارش روابط عمومی بانک اقتصادنوین، دبیرخانه جشنواره اعلام کرد که آثار رسیده توسط اساتید علی اکبر قاضی زاده، یونس شکرخواه، فریدون صدیقی، مجید رضاییان، سیف الله صمدیان، منصور ضابطیان و مریم سلیمی داوری خواهند شد و مجید رضاییان، ریاست هیات داوران را برعهده خواهد داشت. مهلت نهایی ارسال آثار به دبیرخانه جشنواره ۱۵ تیرماه ۱۴۰۴ تعیین شده است و ۲۰ مردادماه مراسم اختتامیه آن برگزار خواهد شد. اطلاعات بیشتر درباره جشنواره در اینجا قابل مشاهده است.
افتتاح شعبه رفسنجان بانک اقتصادنوین,۱۴۰۴/۰۲/۲۹,افتتاح شعبه رفسنجان بانک اقتصادنوین شعبه رفسنجان بانک اقتصادنوین که پیش‌ازاین به‌منظور انجام عملیات بازسازی به محل موقت منتقل شده بود با اتمام عملیات بازسازی و تجهیز آماده ارائه خدمات به هموطنان گرامی است. به گزارش روابط عمومی بانک اقتصادنوین، شعبه رفسنجان (کد ۲۷۳۱) که براساس هویت بصری جدید این بانک طراحی و تجهیز شده از روز شنبه ۲۷ اردیبهشت ماه ۱۴۰۴ در محل قبلی به نشانی کرمان، رفسنجان، ابتدای خیابان مطهری، نبش کوچه شماره۳ پذیرای مشتریان ارجمند خواهد بود. شایان ذکر است، این شعبه پیش‌تر فعال بوده و اکنون با بهره‌گیری از هویت بصری جدید بانک اقتصادنوین، فعالیت خود را از سر گرفته‌است. این تغییرات در راستای بهبود تجربه مشتریان، ارتقای کیفیت خدمات و ایجاد فضایی مدرن‌تر و کاربرپسند انجام شده تا مراجعه‌کنندگان بتوانند خدمات بانکی را در محیطی بهینه‌تر و دلپذیرتر دریافت کنند.
رئیس هیئت‌مدیره بانک اقتصادنوین: رابطه مشتری با بانک باید برد برد باشد,۱۴۰۴/۰۲/۳۰,رئیس هیئت‌مدیره بانک اقتصادنوین: رابطه مشتری با بانک باید برد برد باشد رئیس هیئت‌مدیره و جمعی از مدیران ارشد بانک اقتصادنوین از شعب شهر شیراز این بانک بازدید کردند. به گزارش روابط عمومی بانک اقتصادنوین، رئیس هیئت‌مدیره بانک در این دیدارها با تاکید بر این که بر اساس استراتژی جدید، مشتریان حقیقی به اندازه مشتریان حقوقی ارزش سازمانی دارند، گفت: محصولات جدید بانک متناسب با نیازهای مشتریان خرد در حال طراحی و عملیاتی شدن است. محسن زرندی مقدم با بیان این که نیازهای مشتری تا زمان رسیدن به هدف نهایی باید توسط شعب پیگیری شود، افزود: رابطه مشتری با بانک باید برد برد باشد، بنابراین همه ما در قبال تامین نیازهای قانونی مشتریان مسئولیم. وی با اشاره به این که شهر شیراز و استان فارس از نقاط برخوردار کشور است، اظهار کرد: باید تلاش کنیم نتیجه این پتانسیل مطلوب در عملکرد شعب و بانک دیده شود. در جریان این دیدارها که با حضور حسن مونسان معاون بانکداری خرد و سعدالله عیسی‌زاده معاون سرمایه انسانی و پشتیبانی به همراه مدیران بازاریابی و روابط عمومی بانک انجام شد، پس از گفت و گو با مشتریان و کارکنان، مسائل آنها شنیده و رهنمودهای لازم ارائه شد.
رئیس هیئت مدیره بانک اقتصاد نوین: با ابزارهای سنتی، نمی توان مشتری هوشمند را جذب کرد,۱۴۰۴/۰۲/۳۱,رئیس هیئت مدیره بانک اقتصاد نوین: با ابزارهای سنتی، نمی توان مشتری هوشمند را جذب کرد رئیس هیئت مدیره بانک اقتصاد نوین با تاکید بر این که نظام بانکداری کشور با پدیده مشتری هوشمند مواجه است، گفت: مشتری هوشمند، تمایز رفتار حرفه ای و غیرحرفه ای از سوی بانکدار را متوجه است و به تنهایی با ابزارهای سنتی مانند نرخ سود نمی توان او را جذب کرد، بنابراین شعبه، باید مشاور مشتری باشد. به گزارش روابط عمومی بانک اقتصاد نوین، محسن زرندی مقدم در مراسم معارفه سرپرست منطقه جنوب ایران این بانک با بیان این که اطلاع از شرایط و خدمات بانک در کنار اطلاع از شرایط و نیازهای مشتری، ترکیبی موفق برای رسیدن به اهداف و تعالی در مسیر کاری است، اظهار کرد: همکاران شعب باید شنونده ای خوب برای مشتری باشند و با اشراف به شرایط بانک، راهکارهای متناسب با نیاز او را خلق کنند. وی همچنین با اشاره به این که نظام شایسته سالاری باید در بانک حکم فرما شود، ادامه داد: شایسته سالاری باید بر اساس ویژگی های مشخص، مسیر شغلی کارکنان را ترسیم کند تا رشدی یکپارچه در تمام بخش‌های بانک ایجاد شود. معاون بانکداری خرد بانک اقتصادنوین نیز در این جلسه با بیان این که عملکرد هوشمندانه و جسورانه با توجه به پتانسیل های منطقه، محرک خوبی برای شعب خواهد بود، گفت: تغییرات ایجاد شده در بانک با هدف ایجاد حس جدید عملیاتی شده است تا بتوانیم با مدل جدید تعریف شده در دامنه مشتریان و سیاست های کلان بانک، صف و ستاد را همسو کنیم. سعدالله عیسی‌زاده معاون سرمایه انسانی و پشتیبانی بانک نیز تاکید کرد که همه تلاش ها در مجموعه بانک به منظور استقرار نظام شایسته سالاری و ارزش گذاری درست تلاش‌های همکاران به کار گرفته شده است. در پایان این مراسم و با حضور کارکنان شعب شیراز و روسای شعب منطقه جنوب، از زحمات مهرزاد نظری نیا تقدیر و محمدحسین زارعی به عنوان سرپرست منطقه جنوب ایران بانک اقتصاد نوین معرفی شد.
آمادگی بانک اقتصادنوین برای حمایت از «سرمایه‌گذاری برای تولید»,۱۴۰۴/۰۲/۳۱,آمادگی بانک اقتصادنوین برای حمایت از «سرمایه‌گذاری برای تولید» در جریان دومین روز سفر رئیس هیئت مدیره و جمعی از مدیران ارشد بانک اقتصادنوین به استان فارس، بر لزوم استفاده حداکثری از ظرفیت‌های بانک به منظور تحقق شعار«سرمایه‌گذاری برای تولید» تاکید شد. به گزارش روابط عمومی بانک اقتصادنوین، گفت‌وگو با مشتریان وفادار و بررسی نیازهای جدید آنها در مسیر توسعه تولید و فعالیت‌های مشترک بخشی از برنامه‌های این روز بود. رئیس هیئت مدیره، معاون بانکداری خرد و معاون سرمایه انسانی و پشتیبانی به همراه مدیران بازاریابی و روابط عمومی بانک اقتصادنوین در دیدارهایی که با مشتریان بانک داشتند، خاطرنشان کردند که کارکنان بانک اقتصادنوین، مشاوران پولی و مالی آنها در فرایند توسعه فعالیت‌های اقتصادی خواهند بود. همچنین تاکید شد که بانک برای حمایت از بنگاه‌های اقتصادی به منظور کمک به چرخه تولید کشور و توسعه اشتغالزایی و ارزآوری، آمادگی کامل دارد.
رشد 205 درصدی درآمد ارائه خدمات تامین سرمایه نوین,۱۴۰۴/۰۳/۰۵,رشد 205 درصدی درآمد ارائه خدمات تامین سرمایه نوین درآمد ارائه خدمات شرکت تامین سرمایه نوین در سال گذشته با بیش از 205 درصد رشد به رقمی بالاتر از 18 هزار میلیارد ریال رسید. به گزارش روابط عمومی بانک اقتصادنوین، عملکرد دوره 12 ماه منتهی به پایان اسفند ماه سال گذشته نشان می‌دهد که درآمد کل این شرکت بالغ بر 34 هزار میلیارد ریال و تقریبا برابر میانگین صنعت بوده است. تامین سرمایه نوین در سال گذشته، رشد 119 درصدی کل درآمدها را تجربه کرد. همچنین درآمد حاصل از سود سرمایه‌گذاری‌های شرکت تامین سرمایه نوین که غالبا سود حاصل از سرمایه‌گذاری در صندوق‌ها و اوراق است، در سال گذشته حدود 65 درصد نسبت به مدت مشابه سال قبل رشد داشته و بالاتر از میانگین صنعت بوده است.
امکان وکالتی کردن سپرده مشتریان متقاضی خرید خودروی سایپا در بانک اقتصادنوین,۱۴۰۴/۰۳/۰۶,امکان وکالتی کردن سپرده مشتریان متقاضی خرید خودروی سایپا در بانک اقتصادنوین امکان ثبت‌نام در طرح جدید فروش محصولات گروه خودروسازی سایپا با استفاده از حساب وکالتی برای دارندگان حساب در بانک اقتصادنوین فراهم شد. به گزارش روابط عمومی بانک اقتصادنوین، متقاضیان واجد شرایط می‌توانند از روز سه شنبه مورخ ۰۶/ ۰۳/ ۱۴۰۴ تا پایان ساعت ۲۴ روز شنبه مورخ ۱۰/ ۰۳/ ۱۴۰۴ یکی از سپرده‌های انفرادی خود (سرمایه‌گذاری کوتاه‌مدت/ قرض‌الحسنه پس‌انداز) را به صورت حضوری یا غیرحضوری «وکالتی» کرده و مبلغ ۵۰۰ میلیون تومان را در آن مسدود کنند. وکالتی کردن سپرده مشتریان به صورت حضوری با مراجعه به شعب بانک اقتصادنوین و به صورت غیرحضوری از طریق اینترنت بانک جدید ممکن است. وجه مسدود شده که در زمان افتتاح حساب وکالتی جهت ثبت‌نام اولیه واریز می‌شود، تا پایان زمان قرعه‌کشی باید در حساب باقی مانده و امکان کاهش یا برداشت موجودی حساب وکالتی تا پایان این طرح میسر نیست.
رشد 39 درصدی سود بانک اقتصادنوین در اردیبهشت 1404,۱۴۰۴/۰۳/۰۷,آمارها از ثبات و سودآوری ونوین می‌گویند رشد 39 درصدی سود بانک اقتصادنوین در اردیبهشت 1404 بانک اقتصادنوین در اردیبهشت‌ماه سال جاری با کسب 26 هزار میلیارد ریال سود خالص از محل عملیات واسطه‌گری پولی، عملکردی موفق و رو‌به‌رشد را به ثبت رساند. این سود نسبت به مدت مشابه سال گذشته رشدی 39 درصدی را نشان می‌دهد. به گزارش روابط عمومی بانک اقتصادنوین، بر اساس اطلاعات منتشرشده در کدال، بانک اقتصادنوین در اردیبهشت‌ماه 1404 موفق به کسب درآمدی معادل 89 هزار و 701 میلیارد ریال از محل عملیات واسطه‌گری پولی شد. پس از کسر هزینه‌های مرتبط به مبلغ 63 هزار و 697 میلیارد ریال، سود خالص بانک از این محل به 26 هزار و 4 میلیارد ریال رسید. این رقم نسبت به دوره مشابه سال گذشته حاکی از رشدی 39 درصدی است و جایگاه بانک اقتصادنوین را به‌عنوان یکی از سودآورترین بانک‌های کشور بیش‌ازپیش تثبیت می‌کند. همچنین بر اساس نمودار عملکرد پنج‌ساله بانک، رشد 65 درصدی عملیات واسطه‌گری در سال 1403 نسبت به سال پیش از آن، گویای رویکرد حرفه‌ای بانکداری بدون ورود به بنگاه‌داری، عدم نگهداری دارایی‌های منجمد و پایبندی به اصول بانکداری نوین است.
